{
  "output_contract_id": "out_mechanism_a1_schema_bound_extraction_001",
  "format": "json",
  "required_sections": [
    "title",
    "target_venue",
    "primary_metric",
    "evidence_ids"
  ],
  "citation_policy": "every_claim",
  "style_profile": "minimal_json",
  "tool_trace_required": false
}
